{
  "target": {
    "kind": "host",
    "name": "asp-core-profile-smoke",
    "implementation": "private-core-fixture",
    "version": "1.0.0"
  },
  "profile": {
    "id": "asp-core-v1.0",
    "name": "ASP v1.0 Core Profile",
    "scope": "private-core",
    "coreOnly": true,
    "nonCoreProfilesDeferred": [
      "inspect",
      "edit",
      "apply",
      "deployment",
      "dogfood",
      "ace",
      "lattice-parity"
    ]
  },
  "suite": {
    "id": "asp-core-conformance-report",
    "version": "2026-06-24",
    "generatedAt": "2026-06-24T00:00:00Z",
    "runner": "scripts/conformance/run-core-suite.ts",
    "testCommand": "node --experimental-strip-types --test --test-reporter=tap tests/conformance/core/core-host-black-box.test.ts tests/conformance/core/core-profile-smoke.test.ts"
  },
  "summary": {
    "result": "pass",
    "total": 17,
    "passed": 17,
    "failed": 0,
    "skipped": 0,
    "missingRequired": 0
  },
  "requirements": [
    {
      "id": "CORE-HOST-STATUS",
      "title": "Host status exposes ready Core gate state",
      "required": true,
      "status": "covered",
      "assertionIds": [
        "CORE-HOST-STATUS"
      ],
      "sourceSpecSections": [
        "spec/11-core-profile.md:103",
        "spec/08-conformance.md:106"
      ],
      "fixturePaths": [
        "tests/conformance/core/core-host-black-box.test.ts",
        "tests/conformance/fixtures/core/core-host-adoption-receipt.valid.json",
        "examples/core/status.ready.json"
      ]
    },
    {
      "id": "CORE-HOST-CAPABILITIES",
      "title": "Host capabilities expose check-only Core coverage",
      "required": true,
      "status": "covered",
      "assertionIds": [
        "CORE-HOST-CAPABILITIES"
      ],
      "sourceSpecSections": [
        "spec/11-core-profile.md:103",
        "spec/08-conformance.md:106"
      ],
      "fixturePaths": [
        "tests/conformance/core/core-host-black-box.test.ts",
        "tests/conformance/fixtures/core/core-host-adoption-receipt.valid.json",
        "examples/core/capabilities.check-only.json"
      ]
    },
    {
      "id": "CORE-HOST-EVALUATE",
      "title": "Host evaluateChangeset owns allow, deny, and indeterminate decisions",
      "required": true,
      "status": "covered",
      "assertionIds": [
        "CORE-HOST-EVALUATE"
      ],
      "sourceSpecSections": [
        "spec/11-core-profile.md:103",
        "spec/08-conformance.md:106"
      ],
      "fixturePaths": [
        "tests/conformance/core/core-host-black-box.test.ts",
        "tests/conformance/fixtures/core/core-host-adoption-receipt.valid.json",
        "examples/core/evaluate.allow.json",
        "examples/core/evaluate.deny.json",
        "examples/core/evaluate.indeterminate.missing-provider.json",
        "examples/core/evaluate.indeterminate.stale-assessment.json",
        "examples/core/evaluate.indeterminate.degraded-required-coverage.json"
      ]
    },
    {
      "id": "CORE-CHECK-ASSESSMENT",
      "title": "Check providers return the canonical Assessment shape",
      "required": true,
      "status": "covered",
      "assertionIds": [
        "CORE-CHECK-ASSESSMENT"
      ],
      "sourceSpecSections": [
        "spec/11-core-profile.md:103",
        "spec/08-conformance.md:106"
      ],
      "fixturePaths": [
        "schemas/check-assessment.schema.json",
        "schemas/check-evaluate.schema.json",
        "tests/conformance/fixtures/core/check-assessment.valid.complete.json"
      ]
    },
    {
      "id": "CORE-PROVIDER-FORBIDDEN-FIELDS",
      "title": "Provider Assessments cannot smuggle host-owned fields",
      "required": true,
      "status": "covered",
      "assertionIds": [
        "CORE-PROVIDER-FORBIDDEN-FIELDS"
      ],
      "sourceSpecSections": [
        "spec/11-core-profile.md:103",
        "spec/08-conformance.md:106"
      ],
      "fixturePaths": [
        "tests/conformance/fixtures/core/check-assessment.invalid.host-owned-top-level.json",
        "tests/conformance/fixtures/core/check-assessment.invalid.host-owned-nested.json"
      ]
    },
    {
      "id": "CORE-STALE-VALID-AS-OF",
      "title": "Stale required Assessment freshness cannot allow a gate",
      "required": true,
      "status": "covered",
      "assertionIds": [
        "CORE-STALE-VALID-AS-OF"
      ],
      "sourceSpecSections": [
        "spec/11-core-profile.md:103",
        "spec/08-conformance.md:106"
      ],
      "fixturePaths": [
        "tests/conformance/core/core-host-black-box.test.ts",
        "tests/conformance/fixtures/core/check-assessment.valid.complete.json"
      ]
    },
    {
      "id": "CORE-MISSING-REQUIRED-PROVIDER",
      "title": "Missing required provider coverage cannot allow a gate",
      "required": true,
      "status": "covered",
      "assertionIds": [
        "CORE-MISSING-REQUIRED-PROVIDER"
      ],
      "sourceSpecSections": [
        "spec/11-core-profile.md:103",
        "spec/08-conformance.md:106"
      ],
      "fixturePaths": [
        "tests/conformance/core/core-host-black-box.test.ts",
        "tests/conformance/core/helpers/core-host-harness.ts",
        "tests/conformance/core/helpers/core-smoke-helpers.ts"
      ]
    },
    {
      "id": "CORE-MISSING-AUTHORITY",
      "title": "Fresh complete provider coverage without authority cannot allow a gate",
      "required": true,
      "status": "covered",
      "assertionIds": [
        "CORE-MISSING-AUTHORITY"
      ],
      "sourceSpecSections": [
        "spec/11-core-profile.md:87-100",
        "spec/08-conformance.md:163-166"
      ],
      "fixturePaths": [
        "tests/conformance/core/core-host-black-box.test.ts",
        "tests/conformance/fixtures/core/core-host-adoption-receipt.valid.json"
      ]
    },
    {
      "id": "CORE-INSUFFICIENT-ASSURANCE",
      "title": "Authorized fresh coverage below required assurance cannot allow a gate",
      "required": true,
      "status": "covered",
      "assertionIds": [
        "CORE-INSUFFICIENT-ASSURANCE"
      ],
      "sourceSpecSections": [
        "spec/11-core-profile.md:87-100",
        "spec/08-conformance.md:163-166"
      ],
      "fixturePaths": [
        "tests/conformance/core/core-host-black-box.test.ts",
        "tests/conformance/fixtures/core/core-host-adoption-receipt.valid.json"
      ]
    },
    {
      "id": "CORE-PROVIDER-QUARANTINED",
      "title": "Quarantined required provider health cannot allow a gate",
      "required": true,
      "status": "covered",
      "assertionIds": [
        "CORE-PROVIDER-QUARANTINED"
      ],
      "sourceSpecSections": [
        "spec/11-core-profile.md:87-103",
        "spec/08-conformance.md:158-175"
      ],
      "fixturePaths": [
        "tests/conformance/core/core-host-black-box.test.ts",
        "tests/conformance/fixtures/core/core-host-adoption-receipt.valid.json"
      ]
    },
    {
      "id": "CORE-PROVIDER-SKEWED",
      "title": "Skewed required provider health cannot allow a gate",
      "required": true,
      "status": "covered",
      "assertionIds": [
        "CORE-PROVIDER-SKEWED"
      ],
      "sourceSpecSections": [
        "spec/11-core-profile.md:87-103",
        "spec/08-conformance.md:158-175"
      ],
      "fixturePaths": [
        "tests/conformance/core/core-host-black-box.test.ts",
        "tests/conformance/fixtures/core/core-host-adoption-receipt.valid.json"
      ]
    },
    {
      "id": "CORE-HOST-INITIALIZE-CONTRACT-REFUSAL",
      "title": "Required provider initialize contract refusal cannot allow a gate",
      "required": true,
      "status": "covered",
      "assertionIds": [
        "CORE-HOST-INITIALIZE-CONTRACT-REFUSAL"
      ],
      "sourceSpecSections": [
        "spec/11-core-profile.md:87-103",
        "spec/08-conformance.md:158-175",
        "spec/08-conformance.md:209"
      ],
      "fixturePaths": [
        "tests/conformance/core/core-host-black-box.test.ts",
        "tests/conformance/fixtures/core/core-host-adoption-receipt.valid.json",
        "packages/asp/src/core-host.ts",
        "packages/asp/src/core-host-support.ts",
        "packages/asp/src/fake-check-provider.ts"
      ]
    },
    {
      "id": "CORE-PROVIDER-FAIL-OPEN",
      "title": "Fail-open required provider health cannot allow a gate",
      "required": true,
      "status": "covered",
      "assertionIds": [
        "CORE-PROVIDER-FAIL-OPEN"
      ],
      "sourceSpecSections": [
        "spec/11-core-profile.md:87-103",
        "spec/08-conformance.md:158-175"
      ],
      "fixturePaths": [
        "tests/conformance/core/core-host-black-box.test.ts",
        "tests/conformance/fixtures/core/core-host-adoption-receipt.valid.json"
      ]
    },
    {
      "id": "CORE-MALFORMED-REQUIRED-PROVIDER",
      "title": "Malformed required provider data cannot allow a gate",
      "required": true,
      "status": "covered",
      "assertionIds": [
        "CORE-MALFORMED-REQUIRED-PROVIDER"
      ],
      "sourceSpecSections": [
        "spec/11-core-profile.md:103",
        "spec/08-conformance.md:106"
      ],
      "fixturePaths": [
        "tests/conformance/core/core-host-black-box.test.ts",
        "tests/conformance/fixtures/core/check-assessment.invalid.host-owned-nested.json"
      ]
    },
    {
      "id": "CORE-REQUIRED-COVERAGE-VISIBLE",
      "title": "Required coverage remains machine-readable for every degraded reason",
      "required": true,
      "status": "covered",
      "assertionIds": [
        "CORE-REQUIRED-COVERAGE-VISIBLE"
      ],
      "sourceSpecSections": [
        "spec/11-core-profile.md:103",
        "spec/08-conformance.md:106"
      ],
      "fixturePaths": [
        "tests/conformance/core/core-host-black-box.test.ts",
        "examples/core/evaluate.indeterminate.degraded-required-coverage.json"
      ]
    },
    {
      "id": "CORE-HOST-DECISION-AUTHORITATIVE",
      "title": "Host Decisions are authoritative and provider Assessments remain inputs",
      "required": true,